id,level,type,question,option_a,option_b,option_c,option_d,correct,points,required,explanation,topic,source
GPL30B-L1-01,Level 1,multiple_choice,某機關開標後才說本案可以共同投標，招標文件完全沒寫。依第30講，主要錯誤為何？,允許共同投標須先於招標文件載明,共同投標可開標後口頭同意,共同投標不用文件,共同投標只看廠商意願,A,1,TRUE,第30講指出機關允許共同投標之基本規定，重點是招標文件須先載明。,共同投標載明,Notion：政府採購法 / 第30講 / 再一次
GPL30B-L1-02,Level 1,multiple_choice,甲公司同時以個別廠商投標，又加入乙丙共同投標團隊。依第30講，原則上如何？,同一採購案成員不得重複以個別或其他共同投標身分投標,只要甲公司有實力即可重複投標,共同投標一定可以重複參與,只有得標後才禁止重複,A,1,TRUE,第30講指出同一採購案中，成員不得重複以個別或他共同投標身分投標。,成員重複投標,Notion：政府採購法 / 第30講 / 再一次
GPL30B-L1-03,Level 1,multiple_choice,某採購涉及專利技術，若完全禁止成員重複參與會不利競爭。依第30講，機關應如何處理例外？,可在招標文件明訂例外,可由廠商事後自行決定,不得寫入招標文件,開標後由評委臨時決定,A,1,TRUE,第30講指出涉及專利或特殊專業技術，或禁止重複參與不利競爭時，可在招標文件明訂例外。,特殊技術例外,Notion：政府採購法 / 第30講 / 再一次
GPL30B-L1-04,Level 1,multiple_choice,共同投標文件只有其中一家公司業務簽名，其他成員未共同簽署，也未依協議書指定代表。依第30講，主要問題為何？,投標文件簽署不完整,只要任一業務簽名即可,共同投標不得簽署,簽署只在驗收後需要,A,1,TRUE,第30講指出投標文件須由各成員負責人/代理人共同簽署，或依共同投標協議書之指定代表人簽署。,簽署缺漏,Notion：政府採購法 / 第30講 / 再一次
GPL30B-L1-05,Level 1,multiple_choice,共同投標協議書沒有公證或認證，承辦人說有蓋章就好。依第30講，主要錯誤為何？,共同投標協議書需公證或認證,共同投標協議書只要口頭即可,公證認證只適用驗收文件,共同投標不得有協議書,A,1,TRUE,第30講指出共同投標協議書需公證或認證，原則以中文；涉外採購須符合招標文件並附中文譯本。,協議書未認證,Notion：政府採購法 / 第30講 / 再一次
GPL30B-L1-06,Level 1,multiple_choice,涉外共同投標協議書只有外文版本，未附中文譯本，也不符招標文件。依第30講，主要問題為何？,涉外採購雖得用外文，但須附中文譯本並符合招標文件規範,外文版本永遠充分,共同投標協議書不得中文,中文譯本只供廠商內部參考,A,1,TRUE,第30講指出協議書原則中文，涉外採購得以外文，但須附中文譯本並符合招標文件。,協議書語言,Notion：政府採購法 / 第30講 / 再一次
GPL30B-L1-07,Level 1,multiple_choice,共同投標協議書未載明代表廠商、授權權限、各成員主辦項目與契約金額比例。依第30講，主要缺失為何？,協議書必載事項不完整,這些事項可得標後再口頭補,協議書只需標案名稱,契約金額比例不得記載,A,1,TRUE,第30講列共同投標協議書必載事項，包括代表廠商、代表人、授權權限、責任分工、主辦項目與契約金額比例。,責任分工不明,Notion：政府採購法 / 第30講 / 再一次
GPL30B-L1-08,Level 1,multiple_choice,共同投標協議書只寫『大家盡量配合』，未明確寫投標後或得標後連帶履約責任。依第30講，主要問題為何？,連帶履約責任應明確不可含糊,連帶責任不得記載,只要寫配合即可,共同投標各成員一定免責,A,1,TRUE,第30講指出共同投標協議書應明確記載投標後或得標後之連帶履約責任。,連帶責任含糊,Notion：政府採購法 / 第30講 / 再一次
GPL30B-L1-09,Level 1,multiple_choice,共同投標文件沒有說明由代表廠商統一請領或各成員分別請領，也無項目金額對應。依第30講，主要缺失為何？,價金請領方式未明確約定,共同投標不得請款,請款方式一律由機關猜測,價金只能由最小成員請領,A,1,TRUE,第30講指出協議書應載明價金請領方式，代表統一請領或各成員分別請領，並對應項目與金額。,價金請領混亂,Notion：政府採購法 / 第30講 / 再一次
GPL30B-L1-10,Level 1,multiple_choice,共同投標成員之一破產後，協議書完全沒有替代履約安排。依第30講，主要缺失為何？,協議書應載明成員破產或重大情事時之替代履約安排,破產後契約自動變更為同等品,破產成員一定免責且不用安排,替代履約不得約定,A,1,TRUE,第30講列協議書必載事項包括成員破產或重大情事無法續約時，由其他成員承接或另行指定等安排。,成員破產安排,Notion：政府採購法 / 第30講 / 再一次
GPL30B-L1-11,Level 1,multiple_choice,得標後代表廠商未經機關同意，私自變更共同投標協議書責任分工。依第30講，何者正確？,未經機關同意不得變更協議書內容,代表廠商可任意變更,得標後協議書不再重要,變更只需通知其他廠商不用通知機關,A,1,TRUE,第30講指出未經機關同意不得變更共同投標協議書內容，得標後協議書應納入契約。,協議書任意變更,Notion：政府採購法 / 第30講 / 再一次
GPL30B-L1-12,Level 1,multiple_choice,機關已通知共同投標代表人，其他成員主張自己未收到所以完全無效。依第30講，何者正確？,機關對代表人之通知視同對全體成員通知,通知代表人完全無效,必須逐一親送每位員工,只通知會計才有效,A,1,TRUE,第30講指出機關對共同投標代表人之通知，視同對全體成員通知。,通知效力,Notion：政府採購法 / 第30講 / 再一次
GPL30B-L1-13,Level 1,multiple_choice,共同投標完成後，某成員主張全部履約實績都算自己。依第30講，業績認列應依何者？,協議書載明之主辦項目與比例,誰聲音大就算誰,一律由代表廠商全拿,一律平均且不得約定,A,1,TRUE,第30講指出業績認列依協議書載明之主辦項目與比例，於檢收/驗收後據實認列各成員履約實績。,業績歸屬,Notion：政府採購法 / 第30講 / 再一次
GPL30B-L1-14,Level 1,multiple_choice,廠商說品牌名稱類似，所以不需規格、性能比對即可視為同等品。依第30講，主要錯誤為何？,同等品不以品牌等同為準，須規格/性能比對與必要檢測,品牌相似即可同等,同等品不得檢測,同等品只看包裝顏色,A,1,TRUE,第30講提醒不以品牌等同即視為同等品，需通過規格/性能比對與必要檢測。,同等品品牌迷思,Notion：政府採購法 / 第30講 / 再一次
GPL30B-L1-15,Level 1,multiple_choice,同等品投標時未提出廠牌、價格、功能、效益、標準/規格、特性之比對表。依第30講，主要缺失為何？,未提出完整功能比對表,同等品不用表格,只需寫價格即可,只需寫廠商口號,A,1,TRUE,第30講指出同等品功能比對表至少包含廠牌、價格、功能、效益、標準/規格、特性，並對照原規格逐項說明。,功能比對表缺漏,Notion：政府採購法 / 第30講 / 再一次
GPL30B-L1-16,Level 1,multiple_choice,機關未自行審查、未開審查會，也未委託專業審查，直接准用同等品。依第30講，主要問題為何？,未依同等品審查方式辦理,同等品本來就不用審查,只要廠商說明即可當然通過,同等品只能由廠商自行審查,A,1,TRUE,第30講列同等品審查方式包含自行審查、開會審查或委託審查。,同等品審查草率,Notion：政府採購法 / 第30講 / 再一次
GPL30B-L1-17,Level 1,multiple_choice,同等品單價低於原招標基準，但機關仍按原價付款。依第30講，主要錯誤為何？,契約價金應扣減相對差額,低價同等品應加價,價格低高都不影響付款,低價同等品不得使用,A,1,TRUE,第30講指出同等品單價或總價低於原招標要求基準者，契約價金應扣減相對差額。,同等品低價未扣減,Notion：政府採購法 / 第30講 / 再一次
GPL30B-L1-18,Level 1,multiple_choice,廠商提出較高價同等品並要求追加價金。依第30講，應如何處理？,不得因此加價，維持契約價,必須全額加價,自動改為限制性招標,由主驗人私人支付,A,1,TRUE,第30講指出同等品價格高於原要求時，不得因此加價，維持契約價。,同等品高價加價,Notion：政府採購法 / 第30講 / 再一次
GPL30B-L1-19,Level 1,multiple_choice,該案最基層承辦人直接擔任主驗人員。依第30講，主要問題為何？,主驗人員不得為該案最基層承辦人，以避免利益衝突,最基層承辦人一定要主驗,主驗不得由機關人員擔任,主驗只負責付款不用驗收,A,1,TRUE,第30講指出主驗人員不得為該案最基層承辦人，以避免利益衝突。,主驗角色衝突,Notion：政府採購法 / 第30講 / 再一次
GPL30B-L1-20,Level 1,multiple_choice,監驗人員被要求直接裁示改善、拆除重作或退換貨。依第30講，較正確為何？,監驗主要監視驗收程序合規；裁示不符合處置主要屬主驗職掌,監驗負責代表廠商投標,監驗負責決定同等品價格,監驗負責共同投標公證,A,1,TRUE,第30講指出主驗人員裁示不符合處置；監驗人員監視驗收程序合規，維護程序正當。,監驗職掌誤解,Notion：政府採購法 / 第30講 / 再一次
GPL30B-L1-21,Level 1,multiple_choice,驗收紀錄未記載是否逾期、契約金額變更、檢核結果與各角色簽章。依第30講，主要缺失為何？,驗收紀錄欄位不完整，影響日後舉證,驗收紀錄越少越好,只要拍一張照片即可,逾期與變更不得記錄,A,1,TRUE,第30講列初驗/驗收紀錄應含履約期間、是否逾期、契約金額與變更、檢核結果及主驗、會驗、協驗、監驗簽章紀錄。,驗收紀錄不足,Notion：政府採購法 / 第30講 / 再一次
GPL30B-L1-22,Level 1,multiple_choice,機關廢標後一個月才刊登無法決標公告。依第30講，主要問題為何？,廢標公告應於廢標日後14日內刊登,廢標公告可一年後刊登,廢標不用公告,廢標只能口頭通知,A,1,TRUE,第30講指出廢標公告應於廢標日後14日內刊登無法決標公告。,廢標公告逾期,Notion：政府採購法 / 第30講 / 再一次
GPL30B-L1-23,Level 1,multiple_choice,投標截止前機關發布補充招標文件，但未延長投標截止日。依第30講，原則問題為何？,應延長投標截止日，至少延長5日,補充文件不得延長,延長只適用驗收後,一律延長6個月,A,1,TRUE,第30講指出投標截止前發布變更或補充招標文件，原則須延長投標截止日，至少延長5日。,變更文件未延長,Notion：政府採購法 / 第30講 / 再一次
GPL30B-L1-24,Level 1,multiple_choice,機關取消或暫停招標後未作重大變更，卻過很久才想重啟。依第30講，最長得於多久內重啟？,6個月內,14日內,5日內,2年內,A,1,TRUE,第30講指出取消或暫停後未作重大變更，最長得於6個月內重啟，並應考量原已公告或招標天數。,暫停招標重啟,Notion：政府採購法 / 第30講 / 再一次
GPL30B-L1-25,Level 1,multiple_choice,未達公告金額採公開招標且未提供電子領標時，依第30講，等標期原則不得少於多久？,7日,5日,14日,6個月,A,1,TRUE,第30講指出未達公告金額採公開招標且未提供電子領標時，等標期原則不得少於7日。,電子領標等標期,Notion：政府採購法 / 第30講 / 再一次
