id,level,type,question,option_a,option_b,option_c,option_d,correct,points,required,explanation,topic,source
GPL26B-L1-01,Level 1,multiple_choice,某同學只背第26講的個別數字，卻忘記它是在串起招標到驗收的流程。依第26講，主要問題為何？,第26講重點是建立從招標到驗收的完整程序法律鏈結,第26講只考瀝青壓實度,第26講只考工程倫理,第26講只考親屬法,A,1,TRUE,第26講是採購法總複習，整理總則、招標、決標、履約、驗收，建立從招標到驗收的完整程序法律鏈結。,總複習定位,Notion：政府採購法 / 第26講 / 再一次
GPL26B-L1-02,Level 1,multiple_choice,機關為了照顧熟識廠商，故意設計排除其他廠商的條件。依第26講，主要違反何者？,第6條公平、公正、公開、維護公共利益，並禁止不當差別待遇與限制競爭,第65條禁止轉包,驗收15日證明,旋轉門3年,A,1,TRUE,第26講列出第6條基本原則為公平、公正、公開、維護公共利益，並嚴禁不當差別待遇與限制競爭。,第6條原則,Notion：政府採購法 / 第26講 / 再一次
GPL26B-L1-03,Level 1,multiple_choice,某公立學校採購資訊服務，自認不是行政機關所以不適用採購法。依第26講，何者正確？,公立學校屬採購法適用主體,公立學校一律不適用採購法,只有中央部會適用採購法,資訊服務不可能是採購,A,1,TRUE,第26講列出適用主體包含政府機關、公立學校、公營事業、受補助法人團體與BOT案件。,適用主體,Notion：政府採購法 / 第26講 / 再一次
GPL26B-L1-04,Level 1,multiple_choice,受補助法人團體辦理受補助採購，承辦人完全忽略採購法。依第26講，主要風險為何？,受補助法人團體可能屬採購法適用主體,法人團體永遠不適用採購法,只要不是公務員就無採購問題,補助案件必然純私法,A,1,TRUE,第26講適用主體包含受補助法人團體（§4）。,受補助法人團體,Notion：政府採購法 / 第26講 / 再一次
GPL26B-L1-05,Level 1,multiple_choice,採購電腦設備被承辦人誤認為勞務採購。依第26講，較正確分類為何？,財物採購,工程採購,勞務採購,爭議處理,A,1,TRUE,第26講採購類別中，財物包括動產、不動產；電腦設備通常屬動產財物。,類別混淆,Notion：政府採購法 / 第26講 / 再一次
GPL26B-L1-06,Level 1,multiple_choice,採購系統整合與顧問研究服務，被誤認為財物採購。依第26講，較接近何者？,勞務採購,工程採購,財物採購,不良廠商公告,A,1,TRUE,第26講說明勞務採購如顧問、資訊、研究。,類別混淆,Notion：政府採購法 / 第26講 / 再一次
GPL26B-L1-07,Level 1,multiple_choice,某採購金額100萬元，承辦人把它當10萬元以下小額採購處理。依第26講，主要錯誤為何？,第26講列公告金額為100萬元，小額採購為10萬元以下，兩者不可混淆,100萬元就是小額採購,10萬元是公告金額,金額級距完全無意義,A,1,TRUE,第26講列出公告金額100萬元，小額採購10萬元以下。,公告金額,Notion：政府採購法 / 第26講 / 再一次
GPL26B-L1-08,Level 1,multiple_choice,某採購9萬元，承辦人說一定是公告金額以上。依第26講，何者正確？,10萬元以下屬小額採購範圍,9萬元一定是巨額採購,9萬元一定是查核金額,小額採購是100萬元以上,A,1,TRUE,第26講列出小額採購為10萬元以下。,小額採購,Notion：政府採購法 / 第26講 / 再一次
GPL26B-L1-09,Level 1,multiple_choice,一般競爭充分且無特殊理由的採購，承辦人直接想採限制性招標。依第26講，主要問題為何？,公開招標是原則方式，限制性招標須符合第22條特定條件,限制性招標永遠是原則,公開招標不得使用,承辦人可自由選擇不需理由,A,1,TRUE,第26講指出公開招標為原則方式；限制性招標須符合第22條特定條件。,公開招標原則,Notion：政府採購法 / 第26講 / 再一次
GPL26B-L1-10,Level 1,multiple_choice,某案先做資格審查，再邀請符合資格廠商投標。依第26講，較接近何種招標？,選擇性招標,公開招標,限制性招標,違法分批採購,A,1,TRUE,第26講指出選擇性招標為資格審查後邀請。,選擇性招標,Notion：政府採購法 / 第26講 / 再一次
GPL26B-L1-11,Level 1,multiple_choice,承辦人因為熟識某廠商，直接以限制性招標交給該廠商。依第26講，主要錯誤為何？,限制性招標須符合第22條特定條件，熟識廠商不是理由,熟識廠商就是限制性招標事由,限制性招標不用條件,所有採購都可指定熟人,A,1,TRUE,第26講指出限制性招標須符合第22條特定條件，如無廠商投標、緊急採購、專屬技術。,限制性招標條件,Notion：政府採購法 / 第26講 / 再一次
GPL26B-L1-12,Level 1,multiple_choice,某公開招標無廠商投標，機關評估符合條件後改採限制性招標。依第26講，可能依據為何？,第22條特定條件之一，如無廠商投標,第6條可以任意指定,第112條倫理準則,第70條品管制度,A,1,TRUE,第26講列出限制性招標事由包含無廠商投標。,無廠商投標,Notion：政府採購法 / 第26講 / 再一次
GPL26B-L1-13,Level 1,multiple_choice,災害發生急需採購救災物資，機關評估採限制性招標。依第26講，可能屬何種事由？,緊急採購,普通小額文具採購,同質最低標,驗收程序,A,1,TRUE,第26講列出限制性招標事由包含緊急採購。,緊急採購,Notion：政府採購法 / 第26講 / 再一次
GPL26B-L1-14,Level 1,multiple_choice,某設備只有原廠專屬技術能維修，機關考慮限制性招標。依第26講，可能屬何種事由？,專屬技術,公告金額,小額採購,最低標,A,1,TRUE,第26講列出限制性招標事由包含專屬技術。,專屬技術,Notion：政府採購法 / 第26講 / 再一次
GPL26B-L1-15,Level 1,multiple_choice,採購標準化規格品，品質差異小，承辦人卻想用最有利標大幅評創意。依第26講，較適合何者？,最低標，因屬同質採購,最有利標，所有案件一律適用,限制性招標指定廠商,履約仲裁,A,1,TRUE,第26講指出最低標適用於同質採購，規格明確、品質差異小。,最低標同質,Notion：政府採購法 / 第26講 / 再一次
GPL26B-L1-16,Level 1,multiple_choice,採購專業資訊系統，技術與品質差異大，若只看最低價可能風險高。依第26講，較適合何者？,最有利標，因屬異質採購,一律最低標,一律小額採購,不得評品質,A,1,TRUE,第26講指出最有利標適用於異質採購，技術、品質差異大。,最有利標異質,Notion：政府採購法 / 第26講 / 再一次
GPL26B-L1-17,Level 1,multiple_choice,某標價低於底價80%，機關不要求說明也不要求擔保，直接決標。依第26講，主要問題為何？,第58條低價處理應要求廠商說明或提供擔保,低於80%必然最優且免審,第58條只管驗收,低價越低越不用管,A,1,TRUE,第26講指出第58條低價處理：標價低於底價80%時，應要求廠商說明或提供擔保。,低價80%,Notion：政府採購法 / 第26講 / 再一次
GPL26B-L1-18,Level 1,multiple_choice,承包商用不合理低價搶標，後續履約品質可能出問題。依第26講，第58條處理目的為何？,防範低價搶標風險,鼓勵廠商無限低價,取消所有履約管理,使所有標案都不能決標,A,1,TRUE,第26講指出第58條要求說明或擔保，是為防範低價搶標風險。,低價搶標,Notion：政府採購法 / 第26講 / 再一次
GPL26B-L1-19,Level 1,multiple_choice,得標廠商把整個契約轉給他人履行，卻說只是合法分包。依第26講，何者正確？,第65條禁止轉包，但允許合法分包，兩者不可混淆,轉包一定合法,分包一定違法,第65條只管招標公告,A,1,TRUE,第26講指出第65條禁止轉包，但允許合法分包。,轉包分包,Notion：政府採購法 / 第26講 / 再一次
GPL26B-L1-20,Level 1,multiple_choice,工程完工後，機關遲遲不要求送件與啟動驗收。依第26講，完工後多久內送件？,7日內,30日內,20日內,15日內,A,1,TRUE,第26講驗收時限為完工7日內送件。,驗收起點,Notion：政府採購法 / 第26講 / 再一次
GPL26B-L1-21,Level 1,multiple_choice,依第26講，完工送件後，機關原則上多久內驗收？,30日內,7日內,3年內,無期限,A,1,TRUE,第26講驗收時限包含30日內驗收。,驗收時限,Notion：政府採購法 / 第26講 / 再一次
GPL26B-L1-22,Level 1,multiple_choice,依第26講，驗收流程中正式驗收期限為何？,20日內正式驗收,7日內正式驗收,15日內正式驗收,80日內正式驗收,A,1,TRUE,第26講驗收時限包含20日內正式驗收。,正式驗收,Notion：政府採購法 / 第26講 / 再一次
GPL26B-L1-23,Level 1,multiple_choice,依第26講，驗收後多久內核發證明？,15日內,7日內,30日內,20日內,A,1,TRUE,第26講驗收時限包含15日內核發證明。,證明核發,Notion：政府採購法 / 第26講 / 再一次
GPL26B-L1-24,Level 1,multiple_choice,機關將公告金額以上採購故意拆成多件10萬元以下，以避開採購法程序。依第26講，主要違反何者？,第14條禁止意圖規避採購法而故意分批採購,第65條合法分包,第58條低價處理,第112條倫理準則,A,1,TRUE,第26講指出第14條嚴禁意圖規避採購法而故意分批採購。,分批規避,Notion：政府採購法 / 第26講 / 再一次
GPL26B-L1-25,Level 1,multiple_choice,廠商對招標文件不服，承辦人卻說只能等履約後仲裁。依第26講，主要錯誤為何？,招標/決標階段通常走異議、申訴；履約階段才區分調解、仲裁、訴訟,所有爭議都只能仲裁,招標階段不能救濟,履約階段只能申訴,A,1,TRUE,第26講國考複習要點要求區分招標/決標階段之異議、申訴，以及履約階段之調解、仲裁、訴訟。,爭議階段區分,Notion：政府採購法 / 第26講 / 再一次
